{
  "name": "conservative_eod",
  "version": "1.0",
  "default_sessions": 80,
  "min_sessions": 55,
  "max_eod_age_days": 5,
  "fast_period": 20,
  "slow_period": 50,
  "rsi_period": 14,
  "atr_period": 14,
  "max_atr_pct": 6.0,
  "max_rsi_new_long": 82.0,
  "min_volume_ratio": 0.25,
  "breakout_near_high_ratio": 0.98,
  "breakout_buffer_atr": 0.25,
  "breakout_buffer_pct": 0.002,
  "breakout_stop_atr": 1.25,
  "breakout_sma_stop_atr": 0.5,
  "pullback_band_atr": 0.35,
  "pullback_stop_atr": 1.5,
  "pullback_low_stop_atr": 0.25,
  "reclaim_band_atr": 0.25,
  "reclaim_stop_atr": 1.25,
  "range_stop_atr": 1.5,
  "chase_limit_atr": 0.75,
  "target_r_multiples": [2.0, 3.0],
  "min_reward_to_risk": 1.5,
  "default_risk_fraction": 0.0075,
  "default_max_position_fraction": 0.2
}
